<?xml version="1.0" encoding="UTF-8"?>
<!DOCTYPE connections PUBLIC
  "-//Penrose/DTD Connections 1.1//EN"
  "http://penrose.safehaus.org/dtd/connections.dtd">

<connections>

  <connection name="MySQL">
    <adapter-name>JDBC</adapter-name>
    <parameter>
      <param-name>driver</param-name>
      <param-value>com.mysql.jdbc.Driver</param-value>
    </parameter>
    <parameter>
      <param-name>url</param-name>
      <param-value>jdbc:mysql://localhost/example?autoReconnect=true</param-value>
    </parameter>
    <parameter>
      <param-name>user</param-name>
      <param-value>penrose</param-value>
    </parameter>
    <parameter>
      <param-name>password</param-name>
      <param-value>penrose</param-value>
    </parameter>
  </connection>

  <connection name="penrose">
    <adapter-name>JDBC</adapter-name>
    <parameter>
      <param-name>driver</param-name>
      <param-value>com.mysql.jdbc.Driver</param-value>
    </parameter>
    <parameter>
      <param-name>url</param-name>
      <param-value>jdbc:mysql://localhost/penrose?autoReconnect=true</param-value>
    </parameter>
    <parameter>
      <param-name>user</param-name>
      <param-value>penrose</param-value>
    </parameter>
    <parameter>
      <param-name>password</param-name>
      <param-value>penrose</param-value>
    </parameter>
  </connection>

</connections>
