<?xml version="1.0" encoding="UTF-8"?>
<!DOCTYPE connections PUBLIC
  "-//Penrose/DTD Connections ${product.specification}//EN"
  "http://penrose.safehaus.org/dtd/connections.dtd">

<connections>

  <connection name="LDAP">
    <adapter-name>LDAP</adapter-name>
    <parameter>
      <param-name>java.naming.provider.url</param-name>
      <param-value>${LDAP_URL}</param-value>
    </parameter>
    <parameter>
      <param-name>java.naming.security.principal</param-name>
      <param-value>${LDAP_USER}</param-value>
    </parameter>
    <parameter>
      <param-name>java.naming.security.credentials</param-name>
      <param-value>${LDAP_PASSWORD}</param-value>
    </parameter>
  </connection>

</connections>
