<?xml version="1.0" encoding="UTF-8"?>
<!DOCTYPE connections PUBLIC
  "-//Penrose/DTD Connections ${product.specification}//EN"
  "http://penrose.safehaus.org/dtd/connections.dtd">

<connections>

  <connection name="AD">
    <adapter-name>LDAP</adapter-name>
    <parameter>
      <param-name>java.naming.factory.initial</param-name>
      <param-value>com.sun.jndi.ldap.LdapCtxFactory</param-value>
    </parameter>
    <parameter>
      <param-name>java.naming.provider.url</param-name>
      <param-value>ldap://localhost:389/</param-value>
    </parameter>
    <parameter>
      <param-name>java.naming.security.principal</param-name>
      <param-value>cn=Administrator,cn=Users,dc=Example,dc=com</param-value>
    </parameter>
    <parameter>
      <param-name>java.naming.security.credentials</param-name>
      <param-value>secret</param-value>
    </parameter>
    <parameter>
      <param-name>java.naming.ldap.attributes.binary</param-name>
      <param-value>objectGUID objectSid</param-value>
    </parameter>
  </connection>

  <connection name="LDAP">
    <adapter-name>LDAP</adapter-name>
    <parameter>
      <param-name>java.naming.factory.initial</param-name>
      <param-value>com.sun.jndi.ldap.LdapCtxFactory</param-value>
    </parameter>
    <parameter>
      <param-name>java.naming.provider.url</param-name>
      <param-value>ldap://localhost:390/</param-value>
    </parameter>
    <parameter>
      <param-name>java.naming.security.principal</param-name>
      <param-value>cn=Manager,dc=Example,dc=com</param-value>
    </parameter>
    <parameter>
      <param-name>java.naming.security.credentials</param-name>
      <param-value>secret</param-value>
    </parameter>
  </connection>

</connections>
