<?xml version="1.0" encoding="UTF-8"?>
<!DOCTYPE connections PUBLIC
  "-//Penrose/DTD Connections ${product.specification}//EN"
  "http://penrose.safehaus.org/dtd/connections.dtd">

<connections>

  <connection name="LDAP">
    <adapter-name>LDAP</adapter-name>
    <parameter>
      <param-name>java.naming.factory.initial</param-name>
      <param-value>com.sun.jndi.ldap.LdapCtxFactory</param-value>
    </parameter>
    <parameter>
      <param-name>java.naming.provider.url</param-name>
      <param-value>ldap://localhost/</param-value>
    </parameter>
    <parameter>
      <param-name>java.naming.security.principal</param-name>
      <param-value>cn=Manager,dc=my-domain,dc=com</param-value>
    </parameter>
    <parameter>
      <param-name>java.naming.security.credentials</param-name>
      <param-value>secret</param-value>
    </parameter>
  </connection>

  <connection name="JDBC">
    <adapter-name>JDBC</adapter-name>
    <parameter>
      <param-name>driver</param-name>
      <param-value>com.mysql.jdbc.Driver</param-value>
    </parameter>
    <parameter>
      <param-name>url</param-name>
      <param-value>jdbc:mysql://localhost/lockout?autoReconnect=true</param-value>
    </parameter>
    <parameter>
      <param-name>user</param-name>
      <param-value>penrose</param-value>
    </parameter>
    <parameter>
      <param-name>password</param-name>
      <param-value>penrose</param-value>
    </parameter>
  </connection>

</connections>
